{
  "version": 1,
  "generatedAt": "2026-04-12T07:03:45Z",
  "repo": "lhx499598826/openclaw_external_skills_library",
  "skills": [
    {
      "key": "akshare-stock",
      "category": "StockSkills",
      "path": "categories/StockSkills/akshare-stock",
      "title": "akshare-stock",
      "shortDesc": "基于 AkShare 的 A股行情、财务、板块、资金流与选股分析技能，无需 API key。",
      "tags": [
        "akshare",
        "stocks",
        "a-share",
        "finance",
        "quant",
        "board",
        "fund-flow"
      ],
      "useCases": [
        "查询 A股历史K线",
        "查看板块和概念行情",
        "查看个股资金流向",
        "搜索股票代码或名称",
        "快速做 A股量化数据分析"
      ]
    },
    {
      "key": "bio-copy-number-cnvkit-analysis",
      "category": "Medicalskills",
      "path": "categories/Medicalskills/bio-copy-number-cnvkit-analysis",
      "title": "bio-copy-number-cnvkit-analysis",
      "shortDesc": "CNVkit workflows for CNV detection from exome or targeted sequencing.",
      "tags": [
        "cnv",
        "cnvkit",
        "copy-number",
        "wes"
      ],
      "useCases": [
        "detect CNVs with CNVkit",
        "analyze exome copy number",
        "run tumor-normal CNV workflow"
      ]
    },
    {
      "key": "bio-gatk-variant-calling",
      "category": "Medicalskills",
      "path": "categories/Medicalskills/bio-gatk-variant-calling",
      "title": "bio-gatk-variant-calling",
      "shortDesc": "GATK HaplotypeCaller best-practice guidance for germline SNP/indel calling and joint genotyping.",
      "tags": [
        "gatk",
        "variant-calling",
        "gvcf",
        "genomics"
      ],
      "useCases": [
        "run GATK HaplotypeCaller",
        "call variants from BAM",
        "joint genotype a cohort"
      ]
    },
    {
      "key": "bio-proteomics-quantification",
      "category": "Medicalskills",
      "path": "categories/Medicalskills/bio-proteomics-quantification",
      "title": "bio-proteomics-quantification",
      "shortDesc": "Proteomics quantification guidance for LFQ, TMT/iTRAQ, SILAC, and differential protein-abundance workflows.",
      "tags": [
        "proteomics",
        "mass-spec",
        "lfq",
        "tmt"
      ],
      "useCases": [
        "quantify proteins from mass spec",
        "analyze TMT proteomics",
        "do LFQ normalization"
      ]
    },
    {
      "key": "bio-rnaseq-qc",
      "category": "Medicalskills",
      "path": "categories/Medicalskills/bio-rnaseq-qc",
      "title": "bio-rnaseq-qc",
      "shortDesc": "RNA-seq-specific quality control such as strandedness, rRNA contamination, and gene body coverage.",
      "tags": [
        "rna-seq",
        "qc",
        "rseqc",
        "quality-control"
      ],
      "useCases": [
        "check RNA-seq quality",
        "measure rRNA contamination",
        "verify strandedness"
      ]
    },
    {
      "key": "bio-tumor-fraction-estimation",
      "category": "Medicalskills",
      "path": "categories/Medicalskills/bio-tumor-fraction-estimation",
      "title": "bio-tumor-fraction-estimation",
      "shortDesc": "ctDNA tumor-fraction estimation from shallow whole-genome sequencing using ichorCNA.",
      "tags": [
        "ctdna",
        "tumor-fraction",
        "liquid-biopsy",
        "ichorCNA"
      ],
      "useCases": [
        "estimate tumor fraction from cfDNA",
        "run ichorCNA on shallow WGS",
        "quantify ctDNA burden"
      ]
    },
    {
      "key": "bio-variant-annotation",
      "category": "Medicalskills",
      "path": "categories/Medicalskills/bio-variant-annotation",
      "title": "bio-variant-annotation",
      "shortDesc": "Variant annotation workflows using tools like bcftools, VEP, SnpEff, and ANNOVAR.",
      "tags": [
        "variant-annotation",
        "vep",
        "snpeff",
        "vcf"
      ],
      "useCases": [
        "annotate my VCF",
        "add functional consequences to variants",
        "annotate variants with clinical databases"
      ]
    },
    {
      "key": "bio-variant-calling-clinical-interpretation",
      "category": "Medicalskills",
      "path": "categories/Medicalskills/bio-variant-calling-clinical-interpretation",
      "title": "bio-variant-calling-clinical-interpretation",
      "shortDesc": "Clinical interpretation of called variants with ClinVar, ACMG logic, and pathogenicity prioritization.",
      "tags": [
        "clinical-variants",
        "acmg",
        "clinvar",
        "interpretation"
      ],
      "useCases": [
        "interpret variant pathogenicity",
        "prioritize clinically relevant variants",
        "apply ACMG-style reasoning to variants"
      ]
    },
    {
      "key": "bio-vcf-manipulation",
      "category": "Medicalskills",
      "path": "categories/Medicalskills/bio-vcf-manipulation",
      "title": "bio-vcf-manipulation",
      "shortDesc": "VCF restructuring and comparison using bcftools merge, concat, sort, intersect, and subset operations.",
      "tags": [
        "vcf",
        "bcftools",
        "merge",
        "compare"
      ],
      "useCases": [
        "merge VCF files",
        "intersect two callsets",
        "subset a VCF by sample or region"
      ]
    },
    {
      "key": "bio-vcf-statistics",
      "category": "Medicalskills",
      "path": "categories/Medicalskills/bio-vcf-statistics",
      "title": "bio-vcf-statistics",
      "shortDesc": "VCF summary metrics, concordance checks, and quality statistics with bcftools.",
      "tags": [
        "vcf",
        "stats",
        "concordance",
        "quality"
      ],
      "useCases": [
        "summarize a VCF",
        "check sample concordance",
        "compute variant quality metrics"
      ]
    },
    {
      "key": "bulk-deseq2-analysis",
      "category": "Medicalskills",
      "path": "categories/Medicalskills/bulk-deseq2-analysis",
      "title": "bulk-deseq2-analysis",
      "shortDesc": "Bulk RNA-seq differential-expression workflow using omicverse/PyDESeq2-style DESeq2 analysis.",
      "tags": [
        "bulk-rna-seq",
        "deseq2",
        "differential-expression",
        "omicverse"
      ],
      "useCases": [
        "run bulk RNA-seq DE analysis",
        "do DESeq2 with omicverse",
        "analyze treated vs control counts"
      ]
    },
    {
      "key": "claw-metagenomics",
      "category": "Medicalskills",
      "path": "categories/Medicalskills/claw-metagenomics",
      "title": "claw-metagenomics",
      "shortDesc": "Shotgun metagenomics workflow covering taxonomy, resistome, and functional-pathway profiling.",
      "tags": [
        "metagenomics",
        "taxonomy",
        "resistome",
        "humann"
      ],
      "useCases": [
        "profile a metagenomics sample",
        "analyze resistome from FASTQ",
        "run taxonomy and pathway profiling"
      ]
    },
    {
      "key": "clinvar-database",
      "category": "Medicalskills",
      "path": "categories/Medicalskills/clinvar-database",
      "title": "clinvar-database",
      "shortDesc": "Clinical variant assertions and significance lookup from NCBI ClinVar.",
      "tags": [
        "clinvar",
        "variants",
        "clinical-genetics",
        "pathogenicity"
      ],
      "useCases": [
        "look up a variant in clinvar",
        "find clinvar pathogenicity for BRCA1 variant",
        "annotate clinical significance for variants"
      ]
    },
    {
      "key": "drugbank-database",
      "category": "Medicalskills",
      "path": "categories/Medicalskills/drugbank-database",
      "title": "drugbank-database",
      "shortDesc": "DrugBank data access for drug properties, targets, pharmacology, and interaction analysis.",
      "tags": [
        "drugbank",
        "drugs",
        "targets",
        "pharmacology"
      ],
      "useCases": [
        "search drugbank for a drug",
        "find drug targets",
        "analyze drug-drug interactions"
      ]
    },
    {
      "key": "eng-log",
      "category": "UniversalSkills",
      "path": "categories/UniversalSkills/eng-log",
      "title": "eng-log",
      "shortDesc": "Report-first engineering log and retrieval skill for generating canonical reports, maintaining layered indexes, and querying a local markdown vault with rebuildable metadata.",
      "tags": [
        "engineering-log",
        "reports",
        "retrieval",
        "wiki",
        "indexing",
        "incident-report",
        "design-log",
        "operations-log",
        "markdown-vault",
        "agent-skill"
      ],
      "useCases": [
        "generate a structured engineering report from work history",
        "archive debugging or deployment work as a canonical report",
        "build indexes over engineering reports",
        "query old engineering reports by component or config",
        "maintain a report-first retrieval wiki",
        "reindex a markdown engineering log vault",
        "look up what happened in a prior engineering task",
        "document system design and operational changes for later retrieval"
      ]
    },
    {
      "key": "ensembl-database",
      "category": "Medicalskills",
      "path": "categories/Medicalskills/ensembl-database",
      "title": "ensembl-database",
      "shortDesc": "Ensembl genome and annotation access for genes, sequences, orthologs, and VEP-style variant queries.",
      "tags": [
        "ensembl",
        "genomics",
        "annotation",
        "orthologs"
      ],
      "useCases": [
        "look up an Ensembl gene",
        "retrieve sequence from ensembl",
        "find orthologs across species"
      ]
    },
    {
      "key": "fastq-analysis",
      "category": "Medicalskills",
      "path": "categories/Medicalskills/fastq-analysis",
      "title": "fastq-analysis",
      "shortDesc": "FASTQ-to-count-matrix RNA-seq guidance including SRA download, QC, alignment, and quantification.",
      "tags": [
        "fastq",
        "rna-seq",
        "alignment",
        "qc"
      ],
      "useCases": [